46,638,46_continual_forgetting_learning_catastrophic,"['continual', 'forgetting', 'learning', 'catastrophic', 'cl', 'replay', 'new', 'tasks', 'knowledge', 'memory']","['STAR: Stability-Inducing Weight Perturbation for Continual Learning Humans can naturally learn new and varying tasks in a sequential manner. Continual learning is a class of learning algorithms that updates its learned model as it sees new data (on potentially new tasks) in a sequence. A key challenge in continual learning is that as the model is updated to learn new tasks, it becomes susceptible to catastrophic forgetting, where knowledge of previously learned tasks is lost. A popular approach to mitigate forgetting during continual learning is to maintain a small buffer of previously-seen samples and to replay them during training. However, this approach is limited by the small buffer size, and while forgetting is reduced, it is still present. In this paper, we propose a novel loss function, STAR, that exploits the worst-case parameter perturbation that reduces the KL-divergence of model predictions with that of its local parameter neighborhood to promote stability and alleviate forgetting. STAR can be combined with almost any existing rehearsal-based method as a plug-and-play component. We empirically show that STAR consistently improves the performance of existing methods by up to 15% across varying baselines and achieves superior or competitive accuracy to that of state-of-the-art methods aimed at improving rehearsal-based continual learning.', 'Continual Learning: Applications and the Road Forward Continual learning is a subfield of machine learning, which aims to allow machine learning models to continuously learn on new data, by accumulating knowledge without forgetting what was learned in the past. In this work, we take a step back, and ask: ""Why should one care about continual learning in the first place?"". We set the stage by examining recent continual learning papers published at four major machine learning conferences, and show that memory-constrained settings dominate the field. Then, we discuss five open problems in machine learning, and even though they might seem unrelated to continual learning at first sight, we show that continual learning will inevitably be part of their solution. These problems are model editing, personalization and specialization, on-device learning, faster (re-)training and reinforcement learning. Finally, by comparing the desiderata from these unsolved problems and the current assumptions in continual learning, we highlight and discuss four future directions for continual learning research. We hope that this work offers an interesting perspective on the future of continual learning, while displaying its potential value and the paths we have to pursue in order to make it successful. This work is the result of the many discussions the authors had at the Dagstuhl seminar on Deep Continual Learning, in March 2023.', ""Continual Feature Selection: Spurious Features in Continual Learning Continual Learning (CL) is the research field addressing learning without forgetting when the data distribution is not static. This paper studies spurious features' influence on continual learning algorithms. We show that continual learning algorithms solve tasks by selecting features that are not generalizable. Our experiments highlight that continual learning algorithms face two related problems: (1) spurious features and (2) local spurious features. The first one is due to a covariate shift between training and testing data, while the second is due to the limited access to data at each training step. We study (1) through a consistent set of continual learning experiments varying spurious correlation amount and data distribution support. We show that (2) is a major cause of performance decrease in continual learning along with catastrophic forgetting. This paper presents a different way of understanding performance decrease in continual learning by highlighting the influence of (local) spurious features in algorithms capabilities.""]",Forgetting learning catastrophic,-0.03156510952400128,-0.029112779152275305,📉 Declining,-0.0024523303717259755,-0.2039075916170106,31.223166517695844
47,603,47_malware_detection_intrusion_iot,"['malware', 'detection', 'intrusion', 'iot', 'traffic', 'network', 'attacks', 'security', 'attack', 'ids']","['A Novel Approach to Malicious Code Detection Using CNN-BiLSTM and Feature Fusion With the rapid advancement of Internet technology, the threat of malware to computer systems and network security has intensified. Malware affects individual privacy and security and poses risks to critical infrastructures of enterprises and nations. The increasing quantity and complexity of malware, along with its concealment and diversity, challenge traditional detection techniques. Static detection methods struggle against variants and packed malware, while dynamic methods face high costs and risks that limit their application. Consequently, there is an urgent need for novel and efficient malware detection techniques to improve accuracy and robustness.   This study first employs the minhash algorithm to convert binary files of malware into grayscale images, followed by the extraction of global and local texture features using GIST and LBP algorithms. Additionally, the study utilizes IDA Pro to decompile and extract opcode sequences, applying N-gram and tf-idf algorithms for feature vectorization. The fusion of these features enables the model to comprehensively capture the behavioral characteristics of malware.   In terms of model construction, a CNN-BiLSTM fusion model is designed to simultaneously process image features and opcode sequences, enhancing classification performance. Experimental validation on multiple public datasets demonstrates that the proposed method significantly outperforms traditional detection techniques in terms of accuracy, recall, and F1 score, particularly in detecting variants and obfuscated malware with greater stability.   The research presented in this paper offers new insights into the development of malware detection technologies, validating the effectiveness of feature and model fusion, and holds promising application prospects.', 'Explainable Artificial Intelligence (XAI) for Malware Analysis: A Survey of Techniques, Applications, and Open Challenges Machine learning (ML) has rapidly advanced in recent years, revolutionizing fields such as finance, medicine, and cybersecurity. In malware detection, ML-based approaches have demonstrated high accuracy; however, their lack of transparency poses a significant challenge. Traditional black-box models often fail to provide interpretable justifications for their predictions, limiting their adoption in security-critical environments where understanding the reasoning behind a detection is essential for threat mitigation and response. Explainable AI (XAI) addresses this gap by enhancing model interpretability while maintaining strong detection capabilities. This survey presents a comprehensive review of state-of-the-art ML techniques for malware analysis, with a specific focus on explainability methods. We examine existing XAI frameworks, their application in malware classification and detection, and the challenges associated with making malware detection models more interpretable. Additionally, we explore recent advancements and highlight open research challenges in the field of explainable malware analysis. By providing a structured overview of XAI-driven malware detection approaches, this survey serves as a valuable resource for researchers and practitioners seeking to bridge the gap between ML performance and explainability in cybersecurity.', 'Malware Squid: A Novel IoT Malware Traffic Analysis Framework using Convolutional Neural Network and Binary Visualisation Internet of Things devices have seen a rapid growth and popularity in recent years with many more ordinary devices gaining network capability and becoming part of the ever growing IoT network. With this exponential growth and the limitation of resources, it is becoming increasingly harder to protect against security threats such as malware due to its evolving faster than the defence mechanisms can handle with. The traditional security systems are not able to detect unknown malware as they use signature-based methods. In this paper, we aim to address this issue by introducing a novel IoT malware traffic analysis approach using neural network and binary visualisation. The prime motivation of the proposed approach is to faster detect and classify new malware (zero-day malware). The experiment results show that our method can satisfy the accuracy requirement of practical application.']",Detection intrusion iot,0.00335422007487378,-0.003665732265984726,🌱 Emerging,0.007019952340858506,0.02147899712565672,33.7326569205172
48,595,48_recognition_activity_har_action,"['recognition', 'activity', 'har', 'action', 'gait', 'video', 'human', 'sensor', 'rehabilitation', 'temporal']","['Limitations in Employing Natural Language Supervision for Sensor-Based Human Activity Recognition -- And Ways to Overcome Them Cross-modal contrastive pre-training between natural language and other modalities, e.g., vision and audio, has demonstrated astonishing performance and effectiveness across a diverse variety of tasks and domains. In this paper, we investigate whether such natural language supervision can be used for wearable sensor based Human Activity Recognition (HAR), and discover that-surprisingly-it performs substantially worse than standard end-to-end training and self-supervision. We identify the primary causes for this as: sensor heterogeneity and the lack of rich, diverse text descriptions of activities. To mitigate their impact, we also develop strategies and assess their effectiveness through an extensive experimental evaluation. These strategies lead to significant increases in activity recognition, bringing performance closer to supervised and self-supervised training, while also enabling the recognition of unseen activities and cross modal retrieval of videos. Overall, our work paves the way for better sensor-language learning, ultimately leading to the development of foundational models for HAR using wearables.', 'Human Activity Recognition using Attribute-Based Neural Networks and Context Information We consider human activity recognition (HAR) from wearable sensor data in manual-work processes, like warehouse order-picking. Such structured domains can often be partitioned into distinct process steps, e.g., packaging or transporting. Each process step can have a different prior distribution over activity classes, e.g., standing or walking, and different system dynamics. Here, we show how such context information can be integrated systematically into a deep neural network-based HAR system. Specifically, we propose a hybrid architecture that combines a deep neural network-that estimates high-level movement descriptors, attributes, from the raw-sensor data-and a shallow classifier, which predicts activity classes from the estimated attributes and (optional) context information, like the currently executed process step. We empirically show that our proposed architecture increases HAR performance, compared to state-of-the-art methods. Additionally, we show that HAR performance can be further increased when information about process steps is incorporated, even when that information is only partially correct.', ""HAR-GCNN: Deep Graph CNNs for Human Activity Recognition From Highly Unlabeled Mobile Sensor Data The problem of human activity recognition from mobile sensor data applies to multiple domains, such as health monitoring, personal fitness, daily life logging, and senior care. A critical challenge for training human activity recognition models is data quality. Acquiring balanced datasets containing accurate activity labels requires humans to correctly annotate and potentially interfere with the subjects' normal activities in real-time. Despite the likelihood of incorrect annotation or lack thereof, there is often an inherent chronology to human behavior. For example, we take a shower after we exercise. This implicit chronology can be used to learn unknown labels and classify future activities. In this work, we propose HAR-GCCN, a deep graph CNN model that leverages the correlation between chronologically adjacent sensor measurements to predict the correct labels for unclassified activities that have at least one activity label. We propose a new training strategy enforcing that the model predicts the missing activity labels by leveraging the known ones. HAR-GCCN shows superior performance relative to previously used baseline methods, improving classification accuracy by about 25% and up to 68% on different datasets. Code is available at \\url{https://github.com/abduallahmohamed/HAR-GCNN}.""]",Activity har action,-0.04958492362989705,-0.01673036590337388,📉 Declining,-0.03285455772652317,-0.3168595954530977,29.96554080364003
49,565,49_sentiment_aspect_analysis_absa,"['sentiment', 'aspect', 'analysis', 'absa', 'aspectbased', 'opinion', 'polarity', 'reviews', 'the', 'classification']","['Sentiment analysis and opinion mining on educational data: A survey Sentiment analysis AKA opinion mining is one of the most widely used NLP applications to identify human intentions from their reviews. In the education sector, opinion mining is used to listen to student opinions and enhance their learning-teaching practices pedagogically. With advancements in sentiment annotation techniques and AI methodologies, student comments can be labelled with their sentiment orientation without much human intervention. In this review article, (1) we consider the role of emotional analysis in education from four levels: document level, sentence level, entity level, and aspect level, (2) sentiment annotation techniques including lexicon-based and corpus-based approaches for unsupervised annotations are explored, (3) the role of AI in sentiment analysis with methodologies like machine learning, deep learning, and transformers are discussed, (4) the impact of sentiment analysis on educational procedures to enhance pedagogy, decision-making, and evaluation are presented. Educational institutions have been widely invested to build sentiment analysis tools and process their student feedback to draw their opinions and insights. Applications built on sentiment analysis of student feedback are reviewed in this study. Challenges in sentiment analysis like multi-polarity, polysemous, negation words, and opinion spam detection are explored and their trends in the research space are discussed. The future directions of sentiment analysis in education are discussed.', 'USA: Universal Sentiment Analysis Model & Construction of Japanese Sentiment Text Classification and Part of Speech Dataset Sentiment analysis is a pivotal task in the domain of natural language processing. It encompasses both text-level sentiment polarity classification and word-level Part of Speech(POS) sentiment polarity determination. Such analysis challenges models to understand text holistically while also extracting nuanced information. With the rise of Large Language Models(LLMs), new avenues for sentiment analysis have opened. This paper proposes enhancing performance by leveraging the Mutual Reinforcement Effect(MRE) between individual words and the overall text. It delves into how word polarity influences the overarching sentiment of a passage. To support our research, we annotated four novel Sentiment Text Classification and Part of Speech(SCPOS) datasets, building upon existing sentiment classification datasets. Furthermore, we developed a Universal Sentiment Analysis(USA) model, with a 7-billion parameter size. Experimental results revealed that our model surpassed the performance of gpt-3.5-turbo across all four datasets, underscoring the significance of MRE in sentiment analysis.', 'LLaMAs Have Feelings Too: Unveiling Sentiment and Emotion Representations in LLaMA Models Through Probing Large Language Models (LLMs) have rapidly become central to NLP, demonstrating their ability to adapt to various tasks through prompting techniques, including sentiment analysis. However, we still have a limited understanding of how these models capture sentiment-related information. This study probes the hidden layers of Llama models to pinpoint where sentiment features are most represented and to assess how this affects sentiment analysis.   Using probe classifiers, we analyze sentiment encoding across layers and scales, identifying the layers and pooling methods that best capture sentiment signals. Our results show that sentiment information is most concentrated in mid-layers for binary polarity tasks, with detection accuracy increasing up to 14% over prompting techniques. Additionally, we find that in decoder-only models, the last token is not consistently the most informative for sentiment encoding. Finally, this approach enables sentiment tasks to be performed with memory requirements reduced by an average of 57%.   These insights contribute to a broader understanding of sentiment in LLMs, suggesting layer-specific probing as an effective approach for sentiment tasks beyond prompting, with potential to enhance model utility and reduce memory requirements.']",Aspect analysis absa,-0.3328874553564723,-0.12019418877148118,📉 Declining,-0.2126932665849911,-2.1100384532306617,10.0
50,546,50_multiagent_agents_marl_reinforcement,"['multiagent', 'agents', 'marl', 'reinforcement', 'cooperative', 'learning', 'games', 'cooperation', 'agent', 'communication']","['Tacit Learning with Adaptive Information Selection for Cooperative Multi-Agent Reinforcement Learning In multi-agent reinforcement learning (MARL), the centralized training with decentralized execution (CTDE) framework has gained widespread adoption due to its strong performance. However, the further development of CTDE faces two key challenges. First, agents struggle to autonomously assess the relevance of input information for cooperative tasks, impairing their decision-making abilities. Second, in communication-limited scenarios with partial observability, agents are unable to access global information, restricting their ability to collaborate effectively from a global perspective. To address these challenges, we introduce a novel cooperative MARL framework based on information selection and tacit learning. In this framework, agents gradually develop implicit coordination during training, enabling them to infer the cooperative behavior of others in a discrete space without communication, relying solely on local information. Moreover, we integrate gating and selection mechanisms, allowing agents to adaptively filter information based on environmental changes, thereby enhancing their decision-making capabilities. Experiments on popular MARL benchmarks show that our framework can be seamlessly integrated with state-of-the-art algorithms, leading to significant performance improvements.', 'A Cooperation Graph Approach for Multiagent Sparse Reward Reinforcement Learning Multiagent reinforcement learning (MARL) can solve complex cooperative tasks. However, the efficiency of existing MARL methods relies heavily on well-defined reward functions. Multiagent tasks with sparse reward feedback are especially challenging not only because of the credit distribution problem, but also due to the low probability of obtaining positive reward feedback. In this paper, we design a graph network called Cooperation Graph (CG). The Cooperation Graph is the combination of two simple bipartite graphs, namely, the Agent Clustering subgraph (ACG) and the Cluster Designating subgraph (CDG). Next, based on this novel graph structure, we propose a Cooperation Graph Multiagent Reinforcement Learning (CG-MARL) algorithm, which can efficiently deal with the sparse reward problem in multiagent tasks. In CG-MARL, agents are directly controlled by the Cooperation Graph. And a policy neural network is trained to manipulate this Cooperation Graph, guiding agents to achieve cooperation in an implicit way. This hierarchical feature of CG-MARL provides space for customized cluster-actions, an extensible interface for introducing fundamental cooperation knowledge. In experiments, CG-MARL shows state-of-the-art performance in sparse reward multiagent benchmarks, including the anti-invasion interception task and the multi-cargo delivery task.', ""Context-Aware Bayesian Network Actor-Critic Methods for Cooperative Multi-Agent Reinforcement Learning Executing actions in a correlated manner is a common strategy for human coordination that often leads to better cooperation, which is also potentially beneficial for cooperative multi-agent reinforcement learning (MARL). However, the recent success of MARL relies heavily on the convenient paradigm of purely decentralized execution, where there is no action correlation among agents for scalability considerations. In this work, we introduce a Bayesian network to inaugurate correlations between agents' action selections in their joint policy. Theoretically, we establish a theoretical justification for why action dependencies are beneficial by deriving the multi-agent policy gradient formula under such a Bayesian network joint policy and proving its global convergence to Nash equilibria under tabular softmax policy parameterization in cooperative Markov games. Further, by equipping existing MARL algorithms with a recent method of differentiable directed acyclic graphs (DAGs), we develop practical algorithms to learn the context-aware Bayesian network policies in scenarios with partial observability and various difficulty. We also dynamically decrease the sparsity of the learned DAG throughout the training process, which leads to weakly or even purely independent policies for decentralized execution. Empirical results on a range of MARL benchmarks show the benefits of our approach.""]",Agents marl reinforcement,-0.011827620180818703,-0.018020172360411556,📉 Declining,0.006192552179592853,-0.07456662588446453,32.66326956024225
