20,1832,20_ai_systems_intelligence_artificial,"['ai', 'systems', 'intelligence', 'artificial', 'governance', 'ethical', 'and', 'of', 'the', 'risks']","[""Responsible Artificial Intelligence -- from Principles to Practice The impact of Artificial Intelligence does not depend only on fundamental research and technological developments, but for a large part on how these systems are introduced into society and used in everyday situations. AI is changing the way we work, live and solve challenges but concerns about fairness, transparency or privacy are also growing. Ensuring responsible, ethical AI is more than designing systems whose result can be trusted. It is about the way we design them, why we design them, and who is involved in designing them. In order to develop and use AI responsibly, we need to work towards technical, societal, institutional and legal methods and tools which provide concrete support to AI practitioners, as well as awareness and training to enable participation of all, to ensure the alignment of AI systems with our societies' principles and values."", ""Putting AI Ethics into Practice: The Hourglass Model of Organizational AI Governance The organizational use of artificial intelligence (AI) has rapidly spread across various sectors. Alongside the awareness of the benefits brought by AI, there is a growing consensus on the necessity of tackling the risks and potential harms, such as bias and discrimination, brought about by advanced AI technologies. A multitude of AI ethics principles have been proposed to tackle these risks, but the outlines of organizational processes and practices for ensuring socially responsible AI development are in a nascent state. To address the paucity of comprehensive governance models, we present an AI governance framework, the hourglass model of organizational AI governance, which targets organizations that develop and use AI systems. The framework is designed to help organizations deploying AI systems translate ethical AI principles into practice and align their AI systems and processes with the forthcoming European AI Act. The hourglass framework includes governance requirements at the environmental, organizational, and AI system levels. At the AI system level, we connect governance requirements to AI system life cycles to ensure governance throughout the system's life span. The governance model highlights the systemic nature of AI governance and opens new research avenues into its practical implementation, the mechanisms that connect different AI governance layers, and the dynamics between the AI governance actors. The model also offers a starting point for organizational decision-makers to consider the governance components needed to ensure social acceptability, mitigate risks, and realize the potential of AI."", ""Trustworthy AI: From Principles to Practices The rapid development of Artificial Intelligence (AI) technology has enabled the deployment of various systems based on it. However, many current AI systems are found vulnerable to imperceptible attacks, biased against underrepresented groups, lacking in user privacy protection. These shortcomings degrade user experience and erode people's trust in all AI systems. In this review, we provide AI practitioners with a comprehensive guide for building trustworthy AI systems. We first introduce the theoretical framework of important aspects of AI trustworthiness, including robustness, generalization, explainability, transparency, reproducibility, fairness, privacy preservation, and accountability. To unify currently available but fragmented approaches toward trustworthy AI, we organize them in a systematic approach that considers the entire lifecycle of AI systems, ranging from data acquisition to model development, to system development and deployment, finally to continuous monitoring and governance. In this framework, we offer concrete action items for practitioners and societal stakeholders (e.g., researchers, engineers, and regulators) to improve AI trustworthiness. Finally, we identify key opportunities and challenges for the future development of trustworthy AI systems, where we identify the need for a paradigm shift toward comprehensively trustworthy AI systems.""]",Systems intelligence artificial,-0.0407030383584594,0.0007173482975457797,📈 Strong but Slowing,-0.04142038665600518,-0.30583079572913063,30.088337227403883
21,1772,21_graph_node_gnns_graphs,"['graph', 'node', 'gnns', 'graphs', 'nodes', 'networks', 'gnn', 'neural', 'the', 'learning']","['Graph Alignment for Benchmarking Graph Neural Networks and Learning Positional Encodings We propose a novel benchmarking methodology for graph neural networks (GNNs) based on the graph alignment problem, a combinatorial optimization task that generalizes graph isomorphism by aligning two unlabeled graphs to maximize overlapping edges. We frame this problem as a self-supervised learning task and present several methods to generate graph alignment datasets using synthetic random graphs and real-world graph datasets from multiple domains. For a given graph dataset, we generate a family of graph alignment datasets with increasing difficulty, allowing us to rank the performance of various architectures. Our experiments indicate that anisotropic graph neural networks outperform standard convolutional architectures. To further demonstrate the utility of the graph alignment task, we show its effectiveness for unsupervised GNN pre-training, where the learned node embeddings outperform other positional encodings on three molecular regression tasks and achieve state-of-the-art results on the PCQM4Mv2 dataset with significantly fewer parameters. To support reproducibility and further research, we provide an open-source Python package to generate graph alignment datasets and benchmark new GNN architectures.', 'Graphs Unveiled: Graph Neural Networks and Graph Generation One of the hot topics in machine learning is the field of GNN. The complexity of graph data has imposed significant challenges on existing machine learning algorithms. Recently, many studies on extending deep learning approaches for graph data have emerged. This paper represents a survey, providing a comprehensive overview of Graph Neural Networks (GNNs). We discuss the applications of graph neural networks across various domains. Finally, we present an advanced field in GNNs: graph generation.', 'Graph Attention for Heterogeneous Graphs with Positional Encoding Graph Neural Networks (GNNs) have emerged as the de facto standard for modeling graph data, with attention mechanisms and transformers significantly enhancing their performance on graph-based tasks. Despite these advancements, the performance of GNNs on heterogeneous graphs often remains complex, with networks generally underperforming compared to their homogeneous counterparts. This work benchmarks various GNN architectures to identify the most effective methods for heterogeneous graphs, with a particular focus on node classification and link prediction. Our findings reveal that graph attention networks excel in these tasks. As a main contribution, we explore enhancements to these attention networks by integrating positional encodings for node embeddings. This involves utilizing the full Laplacian spectrum to accurately capture both the relative and absolute positions of each node within the graph, further enhancing performance on downstream tasks such as node classification and link prediction.']",Node gnns graphs,-0.028872573250094947,-0.03553619885334756,📉 Declining,0.0066636256032526105,-0.21597921420921123,31.088759136978993
22,1611,22_explanations_explanation_xai_interpretability,"['explanations', 'explanation', 'xai', 'interpretability', 'attribution', 'concept', 'methods', 'feature', 'counterfactual', 'of']","['Towards Faithful Explanations for Text Classification with Robustness Improvement and Explanation Guided Training Feature attribution methods highlight the important input tokens as explanations to model predictions, which have been widely applied to deep neural networks towards trustworthy AI. However, recent works show that explanations provided by these methods face challenges of being faithful and robust. In this paper, we propose a method with Robustness improvement and Explanation Guided training towards more faithful EXplanations (REGEX) for text classification. First, we improve model robustness by input gradient regularization technique and virtual adversarial training. Secondly, we use salient ranking to mask noisy tokens and maximize the similarity between model attention and feature attribution, which can be seen as a self-training procedure without importing other external information. We conduct extensive experiments on six datasets with five attribution methods, and also evaluate the faithfulness in the out-of-domain setting. The results show that REGEX improves fidelity metrics of explanations in all settings and further achieves consistent gains based on two randomization tests. Moreover, we show that using highlight explanations produced by REGEX to train select-then-predict models results in comparable task performance to the end-to-end method.', 'A survey on improving NLP models with human explanations Training a model with access to human explanations can improve data efficiency and model performance on in- and out-of-domain data. Adding to these empirical findings, similarity with the process of human learning makes learning from explanations a promising way to establish a fruitful human-machine interaction. Several methods have been proposed for improving natural language processing (NLP) models with human explanations, that rely on different explanation types and mechanism for integrating these explanations into the learning process. These methods are rarely compared with each other, making it hard for practitioners to choose the best combination of explanation type and integration mechanism for a specific use-case. In this paper, we give an overview of different methods for learning from human explanations, and discuss different factors that can inform the decision of which method to choose for a specific use-case.', 'Human-Centered Concept Explanations for Neural Networks Understanding complex machine learning models such as deep neural networks with explanations is crucial in various applications. Many explanations stem from the model perspective, and may not necessarily effectively communicate why the model is making its predictions at the right level of abstraction. For example, providing importance weights to individual pixels in an image can only express which parts of that particular image are important to the model, but humans may prefer an explanation which explains the prediction by concept-based thinking. In this work, we review the emerging area of concept based explanations. We start by introducing concept explanations including the class of Concept Activation Vectors (CAV) which characterize concepts using vectors in appropriate spaces of neural activations, and discuss different properties of useful concepts, and approaches to measure the usefulness of concept vectors. We then discuss approaches to automatically extract concepts, and approaches to address some of their caveats. Finally, we discuss some case studies that showcase the utility of such concept-based explanations in synthetic settings and real world applications.']",Explanation xai interpretability,-0.014214462737058326,-0.010547351530003506,📉 Declining,-0.00366711120705482,-0.10497708976050067,32.32467458141949
23,1590,23_adversarial_attacks_attack_robustness,"['adversarial', 'attacks', 'attack', 'robustness', 'examples', 'backdoor', 'perturbations', 'safety', 'against', 'defense']","['On the Effect of Adversarial Training Against Invariance-based Adversarial Examples Adversarial examples are carefully crafted attack points that are supposed to fool machine learning classifiers. In the last years, the field of adversarial machine learning, especially the study of perturbation-based adversarial examples, in which a perturbation that is not perceptible for humans is added to the images, has been studied extensively. Adversarial training can be used to achieve robustness against such inputs. Another type of adversarial examples are invariance-based adversarial examples, where the images are semantically modified such that the predicted class of the model does not change, but the class that is determined by humans does. How to ensure robustness against this type of adversarial examples has not been explored yet. This work addresses the impact of adversarial training with invariance-based adversarial examples on a convolutional neural network (CNN).   We show that when adversarial training with invariance-based and perturbation-based adversarial examples is applied, it should be conducted simultaneously and not consecutively. This procedure can achieve relatively high robustness against both types of adversarial examples. Additionally, we find that the algorithm used for generating invariance-based adversarial examples in prior work does not correctly determine the labels and therefore we use human-determined labels.', ""Fortify the Guardian, Not the Treasure: Resilient Adversarial Detectors This paper presents RADAR-Robust Adversarial Detection via Adversarial Retraining-an approach designed to enhance the robustness of adversarial detectors against adaptive attacks, while maintaining classifier performance. An adaptive attack is one where the attacker is aware of the defenses and adapts their strategy accordingly. Our proposed method leverages adversarial training to reinforce the ability to detect attacks, without compromising clean accuracy. During the training phase, we integrate into the dataset adversarial examples, which were optimized to fool both the classifier and the adversarial detector, enabling the adversarial detector to learn and adapt to potential attack scenarios. Experimental evaluations on the CIFAR-10 and SVHN datasets demonstrate that our proposed algorithm significantly improves a detector's ability to accurately identify adaptive adversarial attacks -- without sacrificing clean accuracy."", 'Scoring Black-Box Models for Adversarial Robustness Deep neural networks are susceptible to adversarial inputs and various methods have been proposed to defend these models against adversarial attacks under different perturbation models. The robustness of models to adversarial attacks has been analyzed by first constructing adversarial inputs for the model, and then testing the model performance on the constructed adversarial inputs. Most of these attacks require the model to be white-box, need access to data labels, and finding adversarial inputs can be computationally expensive. We propose a simple scoring method for black-box models which indicates their robustness to adversarial input. We show that adversarially more robust models have a smaller $l_1$-norm of LIME weights and sharper explanations.']",Attacks attack robustness,0.008188678850399173,-0.005290356935401985,🌱 Emerging,0.013479035785801157,0.060367906981296085,34.165652275756976
24,1498,24_series_forecasting_time_weather,"['series', 'forecasting', 'time', 'weather', 'timeseries', 'data', 'climate', 'temporal', 'multivariate', 'the']","['Inter-Series Transformer: Attending to Products in Time Series Forecasting Time series forecasting is an important task in many fields ranging from supply chain management to weather forecasting. Recently, Transformer neural network architectures have shown promising results in forecasting on common time series benchmark datasets. However, application to supply chain demand forecasting, which can have challenging characteristics such as sparsity and cross-series effects, has been limited.   In this work, we explore the application of Transformer-based models to supply chain demand forecasting. In particular, we develop a new Transformer-based forecasting approach using a shared, multi-task per-time series network with an initial component applying attention across time series, to capture interactions and help address sparsity. We provide a case study applying our approach to successfully improve demand prediction for a medical device manufacturing company. To further validate our approach, we also apply it to public demand forecasting datasets as well and demonstrate competitive to superior performance compared to a variety of baseline and state-of-the-art forecast methods across the private and public datasets.', 'BALM-TSF: Balanced Multimodal Alignment for LLM-Based Time Series Forecasting Time series forecasting is a long-standing and highly challenging research topic. Recently, driven by the rise of large language models (LLMs), research has increasingly shifted from purely time series methods toward harnessing textual modalities to enhance forecasting performance. However, the vast discrepancy between text and temporal data often leads current multimodal architectures to over-emphasise one modality while neglecting the other, resulting in information loss that harms forecasting performance. To address this modality imbalance, we introduce BALM-TSF (Balanced Multimodal Alignment for LLM-Based Time Series Forecasting), a lightweight time series forecasting framework that maintains balance between the two modalities. Specifically, raw time series are processed by the time series encoder, while descriptive statistics of raw time series are fed to an LLM with learnable prompt, producing compact textual embeddings. To ensure balanced cross-modal context alignment of time series and textual embeddings, a simple yet effective scaling strategy combined with a contrastive objective then maps these textual embeddings into the latent space of the time series embeddings. Finally, the aligned textual semantic embeddings and time series embeddings are together integrated for forecasting. Extensive experiments on standard benchmarks show that, with minimal trainable parameters, BALM-TSF achieves state-of-the-art performance in both long-term and few-shot forecasting, confirming its ability to harness complementary information from text and time series. Code is available at https://github.com/ShiqiaoZhou/BALM-TSF.', ""Time Series Forecasting with LLMs: Understanding and Enhancing Model Capabilities Large language models (LLMs) have been applied in many fields and have developed rapidly in recent years. As a classic machine learning task, time series forecasting has recently been boosted by LLMs. Recent works treat large language models as \\emph{zero-shot} time series reasoners without further fine-tuning, which achieves remarkable performance. However, there are some unexplored research problems when applying LLMs for time series forecasting under the zero-shot setting. For instance, the LLMs' preferences for the input time series are less understood. In this paper, by comparing LLMs with traditional time series forecasting models, we observe many interesting properties of LLMs in the context of time series forecasting. First, our study shows that LLMs perform well in predicting time series with clear patterns and trends, but face challenges with datasets lacking periodicity. This observation can be explained by the ability of LLMs to recognize the underlying period within datasets, which is supported by our experiments. In addition, the input strategy is investigated, and it is found that incorporating external knowledge and adopting natural language paraphrases substantially improve the predictive performance of LLMs for time series. Overall, our study contributes insight into LLMs' advantages and limitations in time series forecasting under different conditions.""]",Forecasting time weather,0.024022113430595824,0.013038732985192491,🚀 Strong & Accelerating,0.010983380445403333,0.1756629895987209,35.44936620450038
25,1446,25_dialogue_dialog_intent_taskoriented,"['dialogue', 'dialog', 'intent', 'taskoriented', 'dialogues', 'conversational', 'response', 'systems', 'user', 'conversation']","['Enhancing Dialogue State Tracking Models through LLM-backed User-Agents Simulation Dialogue State Tracking (DST) is designed to monitor the evolving dialogue state in the conversations and plays a pivotal role in developing task-oriented dialogue systems. However, obtaining the annotated data for the DST task is usually a costly endeavor. In this paper, we focus on employing LLMs to generate dialogue data to reduce dialogue collection and annotation costs. Specifically, GPT-4 is used to simulate the user and agent interaction, generating thousands of dialogues annotated with DST labels. Then a two-stage fine-tuning on LLaMA 2 is performed on the generated data and the real data for the DST prediction. Experimental results on two public DST benchmarks show that with the generated dialogue data, our model performs better than the baseline trained solely on real data. In addition, our approach is also capable of adapting to the dynamic demands in real-world scenarios, generating dialogues in new domains swiftly. After replacing dialogue segments in any domain with the corresponding generated ones, the model achieves comparable performance to the model trained on real data.', 'Dialogue State Tracking with Multi-Level Fusion of Predicted Dialogue States and Conversations Most recently proposed approaches in dialogue state tracking (DST) leverage the context and the last dialogue states to track current dialogue states, which are often slot-value pairs. Although the context contains the complete dialogue information, the information is usually indirect and even requires reasoning to obtain. The information in the lastly predicted dialogue states is direct, but when there is a prediction error, the dialogue information from this source will be incomplete or erroneous. In this paper, we propose the Dialogue State Tracking with Multi-Level Fusion of Predicted Dialogue States and Conversations network (FPDSC). This model extracts information of each dialogue turn by modeling interactions among each turn utterance, the corresponding last dialogue states, and dialogue slots. Then the representation of each dialogue turn is aggregated by a hierarchical structure to form the passage information, which is utilized in the current turn of DST. Experimental results validate the effectiveness of the fusion network with 55.03% and 59.07% joint accuracy on MultiWOZ 2.0 and MultiWOZ 2.1 datasets, which reaches the state-of-the-art performance. Furthermore, we conduct the deleted-value and related-slot experiments on MultiWOZ 2.1 to evaluate our model.', 'Training Dialogue Systems by AI Feedback for Improving Overall Dialogue Impression To improve user engagement during conversations with dialogue systems, we must improve individual dialogue responses and dialogue impressions such as consistency, personality, and empathy throughout the entire dialogue. While such dialogue systems have been developing rapidly with the help of large language models (LLMs), reinforcement learning from AI feedback (RLAIF) has attracted attention to align LLM-based dialogue models for such dialogue impressions. In RLAIF, a reward model based on another LLM is used to create a training signal for an LLM-based dialogue model using zero-shot/few-shot prompting techniques. However, evaluating an entire dialogue only by prompting LLMs is challenging. In this study, the supervised fine-tuning (SFT) of LLMs prepared reward models corresponding to 12 metrics related to the impression of the entire dialogue for evaluating dialogue responses. We tuned our dialogue models using the reward model signals as feedback to improve the impression of the system. The results of automatic and human evaluations showed that tuning the dialogue model using our reward model corresponding to dialogue impression improved the evaluation of individual metrics and the naturalness of the dialogue response.']",Dialog intent taskoriented,-0.0586803355457313,-0.048695960264010366,📉 Declining,-0.009984375281720935,-0.4270313384481458,28.738870959393722
