71,288,71_process_mining_business_event,"['process', 'mining', 'business', 'event', 'logs', 'processes', 'monitoring', 'of', 'log', 'the']","['Process Comparison Using Object-Centric Process Cubes Process mining provides ways to analyze business processes. Common process mining techniques consider the process as a whole. However, in real-life business processes, different behaviors exist that make the overall process too complex to interpret. Process comparison is a branch of process mining that isolates different behaviors of the process from each other by using process cubes. Process cubes organize event data using different dimensions. Each cell contains a set of events that can be used as an input to apply process mining techniques. Existing work on process cubes assume single case notions. However, in real processes, several case notions (e.g., order, item, package, etc.) are intertwined. Object-centric process mining is a new branch of process mining addressing multiple case notions in a process. To make a bridge between object-centric process mining and process comparison, we propose a process cube framework, which supports process cube operations such as slice and dice on object-centric event logs. To facilitate the comparison, the framework is integrated with several object-centric process discovery approaches.', 'Discovering Hierarchical Process Models: an Approach Based on Events Clustering Process mining is a field of computer science that deals with discovery and analysis of process models based on automatically generated event logs. Currently, many companies use this technology for optimization and improving their processes. However, a discovered process model may be too detailed, sophisticated and difficult for experts to understand. In this paper, we consider the problem of discovering a hierarchical business process model from a low-level event log, i.e., the problem of automatic synthesis of more readable and understandable process models based on information stored in event logs of information systems.   Discovery of better structured and more readable process models is intensively studied in the frame of process mining research from different perspectives. In this paper, we present an algorithm for discovering hierarchical process models represented as two-level workflow nets. The algorithm is based on predefined event ilustering so that the cluster defines a sub-process corresponding to a high-level transition at the top level of the net. Unlike existing solutions, our algorithm does not impose restrictions on the process control flow and allows for concurrency and iteration.', ""Extracting Semantic Process Information from the Natural Language in Event Logs Process mining focuses on the analysis of recorded event data in order to gain insights about the true execution of business processes. While foundational process mining techniques treat such data as sequences of abstract events, more advanced techniques depend on the availability of specific kinds of information, such as resources in organizational mining and business objects in artifact-centric analysis. However, this information is generally not readily available, but rather associated with events in an ad hoc manner, often even as part of unstructured textual attributes. Given the size and complexity of event logs, this calls for automated support to extract such process information and, thereby, enable advanced process mining techniques. In this paper, we present an approach that achieves this through so-called semantic role labeling of event data. We combine the analysis of textual attribute values, based on a state-of-the-art language model, with a novel attribute classification technique. In this manner, our approach extracts information about up to eight semantic roles per event. We demonstrate the approach's efficacy through a quantitative evaluation using a broad range of event logs and demonstrate the usefulness of the extracted information in a case study.""]",Mining business event,-0.3229443529433996,-0.08983000917116327,📉 Declining,-0.23311434377223636,-1.8299405002936804,13.118655500606536
72,288,72_phishing_cybersecurity_threat_cyber,"['phishing', 'cybersecurity', 'threat', 'cyber', 'cti', 'security', 'emails', 'email', 'spam', 'detection']","[""Enhancing Phishing Email Identification with Large Language Models Phishing has long been a common tactic used by cybercriminals and continues to pose a significant threat in today's digital world. When phishing attacks become more advanced and sophisticated, there is an increasing need for effective methods to detect and prevent them. To address the challenging problem of detecting phishing emails, researchers have developed numerous solutions, in particular those based on machine learning (ML) algorithms. In this work, we take steps to study the efficacy of large language models (LLMs) in detecting phishing emails. The experiments show that the LLM achieves a high accuracy rate at high precision; importantly, it also provides interpretable evidence for the decisions."", ""Lateral Phishing With Large Language Models: A Large Organization Comparative Study The emergence of Large Language Models (LLMs) has heightened the threat of phishing emails by enabling the generation of highly targeted, personalized, and automated attacks. Traditionally, many phishing emails have been characterized by typos, errors, and poor language. These errors can be mitigated by LLMs, potentially lowering the barrier for attackers. Despite this, there is a lack of large-scale studies comparing the effectiveness of LLM-generated lateral phishing emails to those crafted by humans. Current literature does not adequately address the comparative effectiveness of LLM and human-generated lateral phishing emails in a real-world, large-scale organizational setting, especially considering the potential for LLMs to generate more convincing and error-free phishing content. To address this gap, we conducted a pioneering study within a large university, targeting its workforce of approximately 9,000 individuals including faculty, staff, administrators, and student workers. Our results indicate that LLM-generated lateral phishing emails are as effective as those written by communications professionals, emphasizing the critical threat posed by LLMs in leading phishing campaigns. We break down the results of the overall phishing experiment, comparing vulnerability between departments and job roles. Furthermore, to gather qualitative data, we administered a detailed questionnaire, revealing insights into the reasons and motivations behind vulnerable employee's actions. This study contributes to the understanding of cyber security threats in educational institutions and provides a comprehensive comparison of LLM and human-generated phishing emails' effectiveness, considering the potential for LLMs to generate more convincing content. The findings highlight the need for enhanced user education and system defenses to mitigate the growing threat of AI-powered phishing attacks."", 'Next-Generation Phishing: How LLM Agents Empower Cyber Attackers The escalating threat of phishing emails has become increasingly sophisticated with the rise of Large Language Models (LLMs). As attackers exploit LLMs to craft more convincing and evasive phishing emails, it is crucial to assess the resilience of current phishing defenses. In this study we conduct a comprehensive evaluation of traditional phishing detectors, such as Gmail Spam Filter, Apache SpamAssassin, and Proofpoint, as well as machine learning models like SVM, Logistic Regression, and Naive Bayes, in identifying both traditional and LLM-rephrased phishing emails. We also explore the emerging role of LLMs as phishing detection tools, a method already adopted by companies like NTT Security Holdings and JPMorgan Chase. Our results reveal notable declines in detection accuracy for rephrased emails across all detectors, highlighting critical weaknesses in current phishing defenses. As the threat landscape evolves, our findings underscore the need for stronger security controls and regulatory oversight on LLM-generated content to prevent its misuse in creating advanced phishing attacks. This study contributes to the development of more effective Cyber Threat Intelligence (CTI) by leveraging LLMs to generate diverse phishing variants that can be used for data augmentation, harnessing the power of LLMs to enhance phishing detection, and paving the way for more robust and adaptable threat detection systems.']",Cybersecurity threat cyber,-0.014920471519726777,0.018967145443693656,📈 Strong but Slowing,-0.033887616963420436,-0.08454575801860127,32.552160303658695
73,285,73_chart_charts_visualization_visualizations,"['chart', 'charts', 'visualization', 'visualizations', 'visual', 'data', 'and', 'understanding', 'mllms', 'language']","['From Pixels to Insights: A Survey on Automatic Chart Understanding in the Era of Large Foundation Models Data visualization in the form of charts plays a pivotal role in data analysis, offering critical insights and aiding in informed decision-making. Automatic chart understanding has witnessed significant advancements with the rise of large foundation models in recent years. Foundation models, such as large language models, have revolutionized various natural language processing tasks and are increasingly being applied to chart understanding tasks. This survey paper provides a comprehensive overview of the recent developments, challenges, and future directions in chart understanding within the context of these foundation models. We review fundamental building blocks crucial for studying chart understanding tasks. Additionally, we explore various tasks and their evaluation metrics and sources of both charts and textual inputs. Various modeling strategies are then examined, encompassing both classification-based and generation-based approaches, along with tool augmentation techniques that enhance chart understanding performance. Furthermore, we discuss the state-of-the-art performance of each task and discuss how we can improve the performance. Challenges and future directions are addressed, highlighting the importance of several topics, such as domain-specific charts, lack of efforts in developing evaluation metrics, and agent-oriented settings. This survey paper serves as a comprehensive resource for researchers and practitioners in the fields of natural language processing, computer vision, and data analysis, providing valuable insights and directions for future research in chart understanding leveraging large foundation models. The studies mentioned in this paper, along with emerging new research, will be continually updated at: https://github.com/khuangaf/Awesome-Chart-Understanding.', ""START: Spatial and Textual Learning for Chart Understanding Chart understanding is crucial for deploying multimodal large language models (MLLMs) in real-world scenarios such as analyzing scientific papers and technical reports. Unlike natural images, charts pair a structured visual layout (spatial property) with an underlying data representation (textual property) -- grasping both is essential for precise, fine-grained chart reasoning. Motivated by this observation, we propose START, the Spatial and Textual learning for chART understanding. Specifically, we introduce (i) chart-element grounding and (ii) chart-to-code generation to strengthen an MLLM's understanding of both chart visual layout and data details. To facilitate spatial and textual learning, we propose the START-Dataset generated with a novel data-generation pipeline that first leverages an MLLM to translate real chart images into executable chart code, recovering the underlying data representation while preserving the visual distribution of real-world charts. We then evolve the code with a Large Language Model (LLM) to ascertain the positions of chart elements that capture the chart's visual structure, addressing challenges that existing methods cannot handle. To evaluate a model's ability to understand chart spatial structures, we propose the Chart Spatial understanding Benchmark (CS-Bench), filling a critical gap in comprehensive chart understanding evaluation. Leveraging spatial and textual learning, START delivers consistent gains across model sizes and benchmarks over the base models and surpasses prior state-of-the-art by a clear margin. Code, data and models will be publicly available."", ""Are Large Vision Language Models up to the Challenge of Chart Comprehension and Reasoning? An Extensive Investigation into the Capabilities and Limitations of LVLMs Natural language is a powerful complementary modality of communication for data visualizations, such as bar and line charts. To facilitate chart-based reasoning using natural language, various downstream tasks have been introduced recently such as chart question answering, chart summarization, and fact-checking with charts. These tasks pose a unique challenge, demanding both vision-language reasoning and a nuanced understanding of chart data tables, visual encodings, and natural language prompts. Despite the recent success of Large Language Models (LLMs) across diverse NLP tasks, their abilities and limitations in the realm of data visualization remain under-explored, possibly due to their lack of multi-modal capabilities. To bridge the gap, this paper presents the first comprehensive evaluation of the recently developed large vision language models (LVLMs) for chart understanding and reasoning tasks. Our evaluation includes a comprehensive assessment of LVLMs, including GPT-4V and Gemini, across four major chart reasoning tasks. Furthermore, we perform a qualitative evaluation of LVLMs' performance on a diverse range of charts, aiming to provide a thorough analysis of their strengths and weaknesses. Our findings reveal that LVLMs demonstrate impressive abilities in generating fluent texts covering high-level data insights while also encountering common problems like hallucinations, factual errors, and data bias. We highlight the key strengths and limitations of chart comprehension tasks, offering insights for future research.""]",Charts visualization visualizations,-0.0393971848133678,0.0008483752662376224,📈 Strong but Slowing,-0.04024556007960542,-0.22283015467376452,31.012479667814453
74,275,74_editing_knowledge_edits_edited,"['editing', 'knowledge', 'edits', 'edited', 'edit', 'llms', 'ke', 'model', 'facts', 'methods']","['WilKE: Wise-Layer Knowledge Editor for Lifelong Knowledge Editing Knowledge editing aims to rectify inaccuracies in large language models (LLMs) without costly retraining for outdated or erroneous knowledge. However, current knowledge editing methods primarily focus on single editing, failing to meet the requirements for lifelong editing. This study reveals a performance degradation encountered by knowledge editing in lifelong editing, characterized by toxicity buildup and toxicity flash, with the primary cause identified as pattern unmatch. We introduce a knowledge editing approach named Wise-Layer Knowledge Editor (WilKE), which selects editing layer based on the pattern matching degree of editing knowledge across different layers in language models. Experimental results demonstrate that, in lifelong editing, WilKE exhibits an average improvement of 46.2% and 67.8% on editing GPT2-XL and GPT-J relative to state-of-the-art knowledge editing methods.', ""Uncovering Overfitting in Large Language Model Editing Knowledge editing has been proposed as an effective method for updating and correcting the internal knowledge of Large Language Models (LLMs). However, existing editing methods often struggle with complex tasks, such as multi-hop reasoning. In this paper, we identify and investigate the phenomenon of Editing Overfit, where edited models assign disproportionately high probabilities to the edit target, hindering the generalization of new knowledge in complex scenarios. We attribute this issue to the current editing paradigm, which places excessive emphasis on the direct correspondence between the input prompt and the edit target for each edit sample. To further explore this issue, we introduce a new benchmark, EVOKE (EValuation of Editing Overfit in Knowledge Editing), along with fine-grained evaluation metrics. Through comprehensive experiments and analysis, we demonstrate that Editing Overfit is prevalent in current editing methods and that common overfitting mitigation strategies are ineffective in knowledge editing. To overcome this, inspired by LLMs' knowledge recall mechanisms, we propose a new plug-and-play strategy called Learn the Inference (LTI), which introduce a Multi-stage Inference Constraint module to guide the edited models in recalling new knowledge similarly to how unedited LLMs leverage knowledge through in-context learning. Extensive experimental results across a wide range of tasks validate the effectiveness of LTI in mitigating Editing Overfit."", 'Should We Really Edit Language Models? On the Evaluation of Edited Language Models Model editing has become an increasingly popular alternative for efficiently updating knowledge within language models. Current methods mainly focus on reliability, generalization, and locality, with many methods excelling across these criteria. Some recent works disclose the pitfalls of these editing methods such as knowledge distortion or conflict. However, the general abilities of post-edited language models remain unexplored. In this paper, we perform a comprehensive evaluation on various editing methods and different language models, and have following findings. (1) Existing editing methods lead to inevitable performance deterioration on general benchmarks, indicating that existing editing methods maintain the general abilities of the model within only a few dozen edits. When the number of edits is slightly large, the intrinsic knowledge structure of the model is disrupted or even completely damaged. (2) Instruction-tuned models are more robust to editing, showing less performance drop on general knowledge after editing. (3) Language model with large scale is more resistant to editing compared to small model. (4) The safety of the edited model, is significantly weakened, even for those safety-aligned models. Our findings indicate that current editing methods are only suitable for small-scale knowledge updates within language models, which motivates further research on more practical and reliable editing methods. The details of code and reproduction can be found in https://github.com/lqinfdim/EditingEvaluation.']",Knowledge edits edited,-0.003959817311014191,0.005896237014349398,📈 Strong but Slowing,-0.00985605432536359,-0.022255760642905915,33.24570711794828
75,271,75_story_narrative_stories_plot,"['story', 'narrative', 'stories', 'plot', 'narratives', 'generation', 'character', 'storytelling', 'characters', 'writing']","[""Contrastive Learning with Narrative Twins for Modeling Story Salience Understanding narratives requires identifying which events are most salient for a story's progression. We present a contrastive learning framework for modeling narrative salience that learns story embeddings from narrative twins: stories that share the same plot but differ in surface form. Our model is trained to distinguish a story from both its narrative twin and a distractor with similar surface features but different plot. Using the resulting embeddings, we evaluate four narratologically motivated operations for inferring salience (deletion, shifting, disruption, and summarization). Experiments on short narratives from the ROCStories corpus and longer Wikipedia plot summaries show that contrastively learned story embeddings outperform a masked-language-model baseline, and that summarization is the most reliable operation for identifying salient sentences. If narrative twins are not available, random dropout can be used to generate the twins from a single story. Effective distractors can be obtained either by prompting LLMs or, in long-form narratives, by using different parts of the same story."", 'Open-world Story Generation with Structured Knowledge Enhancement: A Comprehensive Survey Storytelling and narrative are fundamental to human experience, intertwined with our social and cultural engagement. As such, researchers have long attempted to create systems that can generate stories automatically. In recent years, powered by deep learning and massive data resources, automatic story generation has shown significant advances. However, considerable challenges, like the need for global coherence in generated stories, still hamper generative models from reaching the same storytelling ability as human narrators. To tackle these challenges, many studies seek to inject structured knowledge into the generation process, which is referred to as structured knowledge-enhanced story generation. Incorporating external knowledge can enhance the logical coherence among story events, achieve better knowledge grounding, and alleviate over-generalization and repetition problems in stories. This survey provides the latest and comprehensive review of this research field: (i) we present a systematic taxonomy regarding how existing methods integrate structured knowledge into story generation; (ii) we summarize involved story corpora, structured knowledge datasets, and evaluation metrics; (iii) we give multidimensional insights into the challenges of knowledge-enhanced story generation and cast light on promising directions for future study.', ""Can LLMs Generate Good Stories? Insights and Challenges from a Narrative Planning Perspective Story generation has been a prominent application of Large Language Models (LLMs). However, understanding LLMs' ability to produce high-quality stories remains limited due to challenges in automatic evaluation methods and the high cost and subjectivity of manual evaluation. Computational narratology offers valuable insights into what constitutes a good story, which has been applied in the symbolic narrative planning approach to story generation. This work aims to deepen the understanding of LLMs' story generation capabilities by using them to solve narrative planning problems. We present a benchmark for evaluating LLMs on narrative planning based on literature examples, focusing on causal soundness, character intentionality, and dramatic conflict. Our experiments show that GPT-4 tier LLMs can generate causally sound stories at small scales, but planning with character intentionality and dramatic conflict remains challenging, requiring LLMs trained with reinforcement learning for complex reasoning. The results offer insights on the scale of stories that LLMs can generate while maintaining quality from different aspects. Our findings also highlight interesting problem solving behaviors and shed lights on challenges and considerations for applying LLM narrative planning in game environments.""]",Narrative stories plot,-0.0660169930311406,0.002720853487354295,📈 Strong but Slowing,-0.06873784651849489,-0.37007819594461644,29.37299637617398
