Topic,Count,Name,Representation,Representative_Docs,label,slope_12m,slope_24m,category,acceleration,growth_score,growth_size
0,9578,0_policy_reinforcement_learning_rl,"['policy', 'reinforcement', 'learning', 'rl', 'robot', 'the', 'driving', 'to', 'in', 'control']","['Policy-Driven World Model Adaptation for Robust Offline Model-based Reinforcement Learning Offline reinforcement learning (RL) offers a powerful paradigm for data-driven control. Compared to model-free approaches, offline model-based RL (MBRL) explicitly learns a world model from a static dataset and uses it as a surrogate simulator, improving data efficiency and enabling potential generalization beyond the dataset support. However, most existing offline MBRL methods follow a two-stage training procedure: first learning a world model by maximizing the likelihood of the observed transitions, then optimizing a policy to maximize its expected return under the learned model. This objective mismatch results in a world model that is not necessarily optimized for effective policy learning. Moreover, we observe that policies learned via offline MBRL often lack robustness during deployment, and small adversarial noise in the environment can lead to significant performance degradation. To address these, we propose a framework that dynamically adapts the world model alongside the policy under a unified learning objective aimed at improving robustness. At the core of our method is a maximin optimization problem, which we solve by innovatively utilizing Stackelberg learning dynamics. We provide theoretical analysis to support our design and introduce computationally efficient implementations. We benchmark our algorithm on twelve noisy D4RL MuJoCo tasks and three stochastic Tokamak Control tasks, demonstrating its state-of-the-art performance.', 'Scenario-Based Hierarchical Reinforcement Learning for Automated Driving Decision Making Developing decision-making algorithms for highly automated driving systems remains challenging, since these systems have to operate safely in an open and complex environments. Reinforcement Learning (RL) approaches can learn comprehensive decision policies directly from experience and already show promising results in simple driving tasks. However, current approaches fail to achieve generalizability for more complex driving tasks and lack learning efficiency. Therefore, we present Scenario-based Automated Driving Reinforcement Learning (SAD-RL), the first framework that integrates Reinforcement Learning (RL) of hierarchical policy in a scenario-based environment. A high-level policy selects maneuver templates that are evaluated and executed by a low-level control logic. The scenario-based environment allows to control the training experience for the agent and to explicitly introduce challenging, but rate situations into the training process. Our experiments show that an agent trained using the SAD-RL framework can achieve safe behaviour in easy as well as challenging situations efficiently. Our ablation studies confirmed that both HRL and scenario diversity are essential for achieving these results.', 'Hierarchical Framework for Interpretable and Probabilistic Model-Based Safe Reinforcement Learning The difficulty of identifying the physical model of complex systems has led to exploring methods that do not rely on such complex modeling of the systems. Deep reinforcement learning has been the pioneer for solving this problem without the need for relying on the physical model of complex systems by just interacting with it. However, it uses a black-box learning approach that makes it difficult to be applied within real-world and safety-critical systems without providing explanations of the actions derived by the model. Furthermore, an open research question in deep reinforcement learning is how to focus the policy learning of critical decisions within a sparse domain. This paper proposes a novel approach for the use of deep reinforcement learning in safety-critical systems. It combines the advantages of probabilistic modeling and reinforcement learning with the added benefits of interpretability and works in collaboration and synchronization with conventional decision-making strategies. The BC-SRLA is activated in specific situations which are identified autonomously through the fused information of probabilistic model and reinforcement learning, such as abnormal conditions or when the system is near-to-failure. Further, it is initialized with a baseline policy using policy cloning to allow minimum interactions with the environment to address the challenges associated with using RL in safety-critical industries. The effectiveness of the BC-SRLA is demonstrated through a case study in maintenance applied to turbofan engines, where it shows superior performance to the prior art and other baselines.']",Reinforcement learning rl,-0.004541090604634373,-0.004037945238481716,📉 Declining,-0.0005031453661526568,-0.041629669236404945,33.02999491452151
1,7400,1_speech_audio_asr_recognition,"['speech', 'audio', 'asr', 'recognition', 'music', 'speaker', 'the', 'and', 'model', 'acoustic']","['On the Effect of Purely Synthetic Training Data for Different Automatic Speech Recognition Architectures In this work we evaluate the utility of synthetic data for training automatic speech recognition (ASR). We use the ASR training data to train a text-to-speech (TTS) system similar to FastSpeech-2. With this TTS we reproduce the original training data, training ASR systems solely on synthetic data. For ASR, we use three different architectures, attention-based encoder-decoder, hybrid deep neural network hidden Markov model and a Gaussian mixture hidden Markov model, showing the different sensitivity of the models to synthetic data generation. In order to extend previous work, we present a number of ablation studies on the effectiveness of synthetic vs. real training data for ASR. In particular we focus on how the gap between training on synthetic and real data changes by varying the speaker embedding or by scaling the model size. For the latter we show that the TTS models generalize well, even when training scores indicate overfitting.', 'Explore the Reinforcement Learning for the LLM based ASR and TTS system In recent years, large language models (LLMs) have played an important role in automatic speech recognition (ASR) and text-to-speech (TTS) systems. While reinforcement learning (RL) has significantly enhanced LLM performance in text-based tasks, its application to ASR and TTS remains underexplored due to the complexity of training audio-based models. In this study, we propose a lightweight RL framework tailored for audio-based LLMs that can process audio inputs and generate audio outputs. Based on this framework, we evaluate the effectiveness of reinforcement learning on both ASR and TTS tasks. For the ASR task, we experiment with different rule-based reward functions within the Group Relative Policy Optimization (GRPO) framework and investigate the impact of RL data construction. For the TTS task, we compare GRPO with Differentiable Reward Optimization (DiffRO) and further combine the two approaches to achieve improved performance. Our experiments demonstrate that RL can significantly enhance the performance of both ASR and TTS systems, even with limited training data and a small number of optimization steps.', 'On decoder-only architecture for speech-to-text and large language model integration Large language models (LLMs) have achieved remarkable success in the field of natural language processing, enabling better human-computer interaction using natural language. However, the seamless integration of speech signals into LLMs has not been explored well. The ""decoder-only"" architecture has also not been well studied for speech processing tasks. In this research, we introduce Speech-LLaMA, a novel approach that effectively incorporates acoustic information into text-based large language models. Our method leverages Connectionist Temporal Classification and a simple audio encoder to map the compressed acoustic features to the continuous semantic space of the LLM. In addition, we further probe the decoder-only architecture for speech-to-text tasks by training a smaller scale randomly initialized speech-LLaMA model from speech-text paired data alone. We conduct experiments on multilingual speech-to-text translation tasks and demonstrate a significant improvement over strong baselines, highlighting the potential advantages of decoder-only models for speech-to-text conversion.']",Audio asr recognition,-0.00010591134456143044,-0.0009468351369893893,📉 Declining,0.0008409237924279588,-0.0009436033988102799,33.48300009250295
2,5206,2_visual_multimodal_video_image,"['visual', 'multimodal', 'video', 'image', 'reasoning', 'models', 'and', 'images', 'visionlanguage', 'to']","['What\'s in the Image? A Deep-Dive into the Vision of Vision Language Models Vision-Language Models (VLMs) have recently demonstrated remarkable capabilities in comprehending complex visual content. However, the mechanisms underlying how VLMs process visual information remain largely unexplored. In this paper, we conduct a thorough empirical analysis, focusing on attention modules across layers. We reveal several key insights about how these models process visual data: (i) the internal representation of the query tokens (e.g., representations of ""describe the image""), is utilized by VLMs to store global image information; we demonstrate that these models generate surprisingly descriptive responses solely from these tokens, without direct access to image tokens. (ii) Cross-modal information flow is predominantly influenced by the middle layers (approximately 25% of all layers), while early and late layers contribute only marginally.(iii) Fine-grained visual attributes and object details are directly extracted from image tokens in a spatially localized manner, i.e., the generated tokens associated with a specific object or attribute attend strongly to their corresponding regions in the image. We propose novel quantitative evaluation to validate our observations, leveraging real-world complex visual scenes. Finally, we demonstrate the potential of our findings in facilitating efficient visual processing in state-of-the-art VLMs.', ""Rethinking Chain-of-Thought Reasoning for Videos Chain-of-thought (CoT) reasoning has been highly successful in solving complex tasks in natural language processing, and recent multimodal large language models (MLLMs) have extended this paradigm to video reasoning. However, these models typically build on lengthy reasoning chains and large numbers of input visual tokens. Motivated by empirical observations from our benchmark study, we hypothesize that concise reasoning combined with a reduced set of visual tokens can be sufficient for effective video reasoning. To evaluate this hypothesis, we design and validate an efficient post-training and inference framework that enhances a video MLLM's reasoning capability. Our framework enables models to operate on compressed visual tokens and generate brief reasoning traces prior to answering. The resulting models achieve substantially improved inference efficiency, deliver competitive performance across diverse benchmarks, and avoid reliance on manual CoT annotations or supervised fine-tuning. Collectively, our results suggest that long, human-like CoT reasoning may not be necessary for general video reasoning, and that concise reasoning can be both effective and efficient. Our code will be released at https://github.com/LaVi-Lab/Rethink_CoT_Video."", 'The Revolution of Multimodal Large Language Models: A Survey Connecting text and visual modalities plays an essential role in generative intelligence. For this reason, inspired by the success of large language models, significant research efforts are being devoted to the development of Multimodal Large Language Models (MLLMs). These models can seamlessly integrate visual and textual modalities, while providing a dialogue-based interface and instruction-following capabilities. In this paper, we provide a comprehensive review of recent visual-based MLLMs, analyzing their architectural choices, multimodal alignment strategies, and training techniques. We also conduct a detailed analysis of these models across a wide range of tasks, including visual grounding, image generation and editing, visual understanding, and domain-specific applications. Additionally, we compile and describe training datasets and evaluation benchmarks, conducting comparisons among existing models in terms of performance and computational requirements. Overall, this survey offers a comprehensive overview of the current state of the art, laying the groundwork for future MLLMs.']",Multimodal video image,-0.007254456336401005,0.0037030126536033957,📈 Strong but Slowing,-0.010957468990004401,-0.06208189011405629,32.80227660929685
3,4961,3_reasoning_cot_mathematical_llms,"['reasoning', 'cot', 'mathematical', 'llms', 'models', 'of', 'that', 'the', 'we', 'to']","[""Question Decomposition Improves the Faithfulness of Model-Generated Reasoning As large language models (LLMs) perform more difficult tasks, it becomes harder to verify the correctness and safety of their behavior. One approach to help with this issue is to prompt LLMs to externalize their reasoning, e.g., by having them generate step-by-step reasoning as they answer a question (Chain-of-Thought; CoT). The reasoning may enable us to check the process that models use to perform tasks. However, this approach relies on the stated reasoning faithfully reflecting the model's actual reasoning, which is not always the case. To improve over the faithfulness of CoT reasoning, we have models generate reasoning by decomposing questions into subquestions. Decomposition-based methods achieve strong performance on question-answering tasks, sometimes approaching that of CoT while improving the faithfulness of the model's stated reasoning on several recently-proposed metrics. By forcing the model to answer simpler subquestions in separate contexts, we greatly increase the faithfulness of model-generated reasoning over CoT, while still achieving some of the performance gains of CoT. Our results show it is possible to improve the faithfulness of model-generated reasoning; continued improvements may lead to reasoning that enables us to verify the correctness and safety of LLM behavior."", 'Reasoning Beyond Chain-of-Thought: A Latent Computational Mode in Large Language Models Chain-of-Thought (CoT) prompting has improved the reasoning performance of large language models (LLMs), but it remains unclear why it works and whether it is the unique mechanism for triggering reasoning in large language models. In this work, we study this question by directly analyzing and intervening on the internal representations of LLMs with Sparse Autoencoders (SAEs), identifying a small set of latent features that are causally associated with LLM reasoning behavior. Across multiple model families and reasoning benchmarks, we find that steering a single reasoning-related latent feature can substantially improve accuracy without explicit CoT prompting. For large models, latent steering achieves performance comparable to standard CoT prompting while producing more efficient outputs. We further observe that this reasoning-oriented internal state is triggered early in generation and can override prompt-level instructions that discourage explicit reasoning. Overall, our results suggest that multi-step reasoning in LLMs is supported by latent internal activations that can be externally activated, while CoT prompting is one effective, but not unique, way of activating this mechanism rather than its necessary cause.', 'When Actions Teach You to Think: Reasoning-Action Synergy via Reinforcement Learning in Conversational Agents Supervised fine-tuning (SFT) has emerged as one of the most effective ways to improve the performance of large language models (LLMs) in downstream tasks. However, SFT can have difficulty generalizing when the underlying data distribution changes, even when the new data does not fall completely outside the training domain. Recent reasoning-focused models such as o1 and R1 have demonstrated consistent gains over their non-reasoning counterparts, highlighting the importance of reasoning for improved generalization and reliability. However, collecting high-quality reasoning traces for SFT remains challenging -- annotations are costly, subjective, and difficult to scale. To address this limitation, we leverage Reinforcement Learning (RL) to enable models to learn reasoning strategies directly from task outcomes. We propose a pipeline in which LLMs generate reasoning steps that guide both the invocation of tools (e.g., function calls) and the final answer generation for conversational agents. Our method employs Group Relative Policy Optimization (GRPO) with rewards designed around tool accuracy and answer correctness, allowing the model to iteratively refine its reasoning and actions. Experimental results demonstrate that our approach improves both the quality of reasoning and the precision of tool invocations, achieving a 1.5% relative improvement over the SFT model (trained without explicit thinking) and a 40% gain compared to the base of the vanilla Qwen3-1.7B model. These findings demonstrate the promise of unifying reasoning and action learning through RL to build more capable and generalizable conversational agents.']",Cot mathematical llms,0.03290991497730937,0.059827699753590494,🚀 Strong & Accelerating,-0.026917784776281123,0.28004903313948365,36.61161714372162
4,4423,4_retrieval_rag_entity_the,"['retrieval', 'rag', 'entity', 'the', 'to', 'relation', 'on', 'we', 'of', 'models']","['Know3-RAG: A Knowledge-aware RAG Framework with Adaptive Retrieval, Generation, and Filtering Recent advances in large language models (LLMs) have led to impressive progress in natural language generation, yet their tendency to produce hallucinated or unsubstantiated content remains a critical concern. To improve factual reliability, Retrieval-Augmented Generation (RAG) integrates external knowledge during inference. However, existing RAG systems face two major limitations: (1) unreliable adaptive control due to limited external knowledge supervision, and (2) hallucinations caused by inaccurate or irrelevant references. To address these issues, we propose Know3-RAG, a knowledge-aware RAG framework that leverages structured knowledge from knowledge graphs (KGs) to guide three core stages of the RAG process, including retrieval, generation, and filtering. Specifically, we introduce a knowledge-aware adaptive retrieval module that employs KG embedding to assess the confidence of the generated answer and determine retrieval necessity, a knowledge-enhanced reference generation strategy that enriches queries with KG-derived entities to improve generated reference relevance, and a knowledge-driven reference filtering mechanism that ensures semantic alignment and factual accuracy of references. Experiments on multiple open-domain QA benchmarks demonstrate that Know3-RAG consistently outperforms strong baselines, significantly reducing hallucinations and enhancing answer reliability.', ""Fact, Fetch, and Reason: A Unified Evaluation of Retrieval-Augmented Generation Large Language Models (LLMs) have demonstrated significant performance improvements across various cognitive tasks. An emerging application is using LLMs to enhance retrieval-augmented generation (RAG) capabilities. These systems require LLMs to understand user queries, retrieve relevant information, and synthesize coherent and accurate responses. Given the increasing real-world deployment of such systems, comprehensive evaluation becomes crucial. To this end, we propose FRAMES (Factuality, Retrieval, And reasoning MEasurement Set), a high-quality evaluation dataset designed to test LLMs' ability to provide factual responses, assess retrieval capabilities, and evaluate the reasoning required to generate final answers. While previous work has provided datasets and benchmarks to evaluate these abilities in isolation, FRAMES offers a unified framework that provides a clearer picture of LLM performance in end-to-end RAG scenarios. Our dataset comprises challenging multi-hop questions that require the integration of information from multiple sources. We present baseline results demonstrating that even state-of-the-art LLMs struggle with this task, achieving 0.40 accuracy with no retrieval. The accuracy is significantly improved with our proposed multi-step retrieval pipeline, achieving an accuracy of 0.66 (>50% improvement). We hope our work will help bridge evaluation gaps and assist in developing more robust and capable RAG systems."", ""Parametric Retrieval Augmented Generation Retrieval-augmented generation (RAG) techniques have emerged as a promising solution to enhance the reliability of large language models (LLMs) by addressing issues like hallucinations, outdated knowledge, and domain adaptation. In particular, existing RAG methods append relevant documents retrieved from external corpus or databases to the input of LLMs to guide their generation process, which we refer to as the in-context knowledge injection method. While this approach is simple and often effective, it has inherent limitations. Firstly, increasing the context length and number of relevant documents can lead to higher computational overhead and degraded performance, especially in complex reasoning tasks. More importantly, in-context knowledge injection operates primarily at the input level, but LLMs store their internal knowledge in their parameters. This gap fundamentally limits the capacity of in-context methods. To this end, we introduce Parametric retrieval-augmented generation (Parametric RAG), a new RAG paradigm that integrates external knowledge directly into the parameters of feed-forward networks (FFN) of an LLM through document parameterization. This approach not only saves online computational costs by eliminating the need to inject multiple documents into the LLMs' input context, but also deepens the integration of external knowledge into the parametric knowledge space of the LLM. Experimental results demonstrate that Parametric RAG substantially enhances both the effectiveness and efficiency of knowledge augmentation in LLMs. Also, it can be combined with in-context RAG methods to achieve even better performance.   We have open-sourced all the code, data, and models in the following anonymized GitHub link: https://github.com/oneal2000/PRAG""]",Rag entity the,-0.04019561194303571,-0.03205217274697726,📉 Declining,-0.00814343919605845,-0.3374341047781279,29.73646091924251
